{
  "$schema": "https://json-schema.org/draft/2020-12/schema",
  "$id": "https://joseph-brendan.github.io/Frame-Relay/schemas/v1/manifest.schema.json",
  "type": "object",
  "properties": {
    "$schema": {
      "type": "string"
    },
    "kitVersion": {
      "type": "string",
      "enum": [
        "1.0"
      ]
    },
    "name": {
      "type": "string",
      "minLength": 1
    },
    "generator": {
      "type": "object",
      "properties": {
        "name": {
          "type": "string",
          "minLength": 1
        },
        "version": {
          "type": "string",
          "minLength": 1
        }
      },
      "required": [
        "name",
        "version"
      ],
      "additionalProperties": false
    },
    "source": {
      "type": "object",
      "properties": {
        "type": {
          "type": "string",
          "const": "figma"
        },
        "fileKey": {
          "type": "string",
          "minLength": 1
        },
        "fileName": {
          "type": "string",
          "minLength": 1
        },
        "page": {
          "type": "string"
        }
      },
      "required": [
        "type",
        "fileKey",
        "fileName"
      ],
      "additionalProperties": false
    },
    "exportedAt": {
      "type": "string",
      "format": "date-time",
      "pattern": "^(?:(?:\\d\\d[2468][048]|\\d\\d[13579][26]|\\d\\d0[48]|[02468][048]00|[13579][26]00)-02-29|\\d{4}-(?:(?:0[13578]|1[02])-(?:0[1-9]|[12]\\d|3[01])|(?:0[469]|11)-(?:0[1-9]|[12]\\d|30)|(?:02)-(?:0[1-9]|1\\d|2[0-8])))T(?:(?:[01]\\d|2[0-3]):[0-5]\\d:[0-5]\\d(?:\\.\\d+)?(?:Z))$"
    },
    "tokensFile": {
      "default": "tokens.json",
      "type": "string"
    },
    "modes": {
      "default": [
        "light"
      ],
      "type": "array",
      "items": {
        "type": "string"
      }
    },
    "components": {
      "type": "array",
      "items": {
        "type": "object",
        "properties": {
          "name": {
            "type": "string",
            "pattern": "^[A-Z][a-zA-Z0-9]*$"
          },
          "file": {
            "type": "string",
            "minLength": 1
          }
        },
        "required": [
          "name",
          "file"
        ],
        "additionalProperties": false
      }
    }
  },
  "required": [
    "kitVersion",
    "name",
    "generator",
    "source",
    "exportedAt",
    "tokensFile",
    "modes",
    "components"
  ],
  "additionalProperties": false
}
